{
  "schemaVersion": "academy-course/v1",
  "id": "d1",
  "title": "PERMANENT RECORD",
  "subtitle": "The D1 registry and the write path",
  "version": "1.0.1",
  "changelog": [
    {
      "version": "1.0.1",
      "date": "2026-08-02",
      "changes": [
        "Re-pinned to nc-zoning-board 20fc456, matching TRANSMISSION PROTOCOLS v2.3.0. The cited ranges in refresh.js and nexus.js moved and were re-verified; no claim changed."
      ]
    },
    {
      "version": "1.0.0",
      "date": "2026-08-02",
      "changes": [
        "Initial seven-module course on the location registry that TRANSMISSION PROTOCOLS reads from: why the registry left git for Cloudflare D1, the schema, the join that replaced a JSON column, the public write path and its validation, the collaborator gate, the materializer, and a capstone.",
        "Assumes TRANSMISSION PROTOCOLS. HTTP, JSON, endpoints, the envelope and the KV serving copy are taught there and are not re-taught here; SQL and databases are assumed to be new and are taught from a plain baseline.",
        "Audited against nc-zoning-board at 091b069, the same commit TRANSMISSION PROTOCOLS v2.2.0 pins."
      ]
    }
  ],
  "estMinutes": 95,
  "requires": ["data-api"],
  "api": {
    "baseUrl": "https://api.nczoning.net",
    "rateLimit": "100 req / 10s / IP"
  },
  "ranks": [
    { "clearance": 1, "title": "RECORDS CLERK" },
    { "clearance": 2, "title": "REGISTRY CLERK" },
    { "clearance": 3, "title": "DATA STEWARD" },
    { "clearance": 4, "title": "INTAKE OFFICER" },
    { "clearance": 5, "title": "REVIEW OFFICER" },
    { "clearance": 6, "title": "REGISTRAR" },
    { "clearance": 7, "title": "CERTIFIED REGISTRAR" }
  ],
  "economy": {
    "currency": "eddies",
    "symbol": "€$",
    "startingBalance": 500,
    "moduleReward": 1000,
    "rightReward": 150,
    "wrongPenalty": 250
  },
  "contentAudit": {
    "projectCommit": "20fc45673599d8b5fd7b786858bff37c3783af5f",
    "auditedAt": "2026-08-02",
    "repos": [
      { "repo": "nczoning/nc-zoning-board", "commit": "20fc45673599d8b5fd7b786858bff37c3783af5f" }
    ],
    "auditNote": "Course v1.0.1, pinned to nczoning/nc-zoning-board at 20fc456. The text was authored against the revision named in the v1.0.0 changelog entry and every cited range was rechecked at the newer SHA, read from origin/main rather than the local dev branch. Every project claim cites file+line at that commit: the nine migrations in worker/migrations, and worker/src/{validate,submissions,github-app,materialize,registry,audit,alerts}.js. The schema claims were read from the migration files, which are the authoritative statement of the schema, rather than from a dump of a live database, and the migrations carry their own reasoning in comments that this course quotes rather than paraphrases where the wording is load-bearing. Live shapes were ground-truthed with curl against api.nczoning.net on 2026-08-02: /v1/tags returns the 14 registry rows in sort_order, and /v1/locations returned 295 records of which 9 carry nexus- ids. Those two are the only D1 content this course can show a learner directly, because everything else it teaches is behind the collaborator gate. THE WRITE-PATH LABS ARE THEREFORE RECONSTRUCTED, NOT CAPTURED, and each says so in its own debrief; the shell runs every lab against canned responses with no live network, so nothing here can post a real submission. General concepts cite official docs (developers.cloudflare.com for D1 and Turnstile, sqlite.org for SQL semantics, MDN for status codes), verified 2026-08-02. The 'why' behind the design decisions comes from the NC-Zoning-Board project wiki, which is not a citable public source, so every such claim is carried back to the code or the migration comment that implements it. Two Board decision records are SUPERSEDED and were deliberately not taught from: cloudflare-worker-d1-submission-system (says git stays the source of truth; the git submission road was retired in 963f130) and api-version-semver-policy (describes the 1.3.0 backfill that was rolled back). Run `npm run freshness` to check the pinned commit."
  },
  "glossary": [
    { "term": "D1", "tier": "general", "def": "Cloudflare's serverless SQL database. Here it is the location registry of record: every location is a row in D1 first, and the KV copy the API serves is rebuilt from it.", "sources": [ { "kind": "official", "label": "Cloudflare - D1", "url": "https://developers.cloudflare.com/d1/" } ] },
    { "term": "SQL", "tier": "general", "def": "Structured Query Language: the language for asking a relational database to store, change or return rows. D1 speaks the SQLite dialect of it.", "sources": [ { "kind": "official", "label": "Cloudflare - D1 SQL statements", "url": "https://developers.cloudflare.com/d1/sql-api/sql-statements/" } ] },
    { "term": "table", "tier": "general", "def": "A named collection of rows that all share the same columns, like one sheet in a spreadsheet. This registry has nine.", "sources": [ { "kind": "project", "label": "worker/migrations/0001_initial_schema.sql", "url": "https://github.com/nczoning/nc-zoning-board/blob/20fc45673599d8b5fd7b786858bff37c3783af5f/worker/migrations/0001_initial_schema.sql" } ] },
    { "term": "primary key", "tier": "general", "def": "The column whose value identifies a row uniquely within its table. No two rows may share one, and the database refuses a duplicate rather than storing it.", "sources": [ { "kind": "official", "label": "SQLite - PRIMARY KEY", "url": "https://www.sqlite.org/lang_createtable.html#the_primary_key" } ] },
    { "term": "registry of record", "tier": "project", "def": "The store where a location exists first and authoritatively, which here is D1. Everything else holding location data, including the KV copy the API serves, is derived and rebuildable.", "sources": [ { "kind": "project", "label": "worker/wrangler.jsonc L83-97", "url": "https://github.com/nczoning/nc-zoning-board/blob/20fc45673599d8b5fd7b786858bff37c3783af5f/worker/wrangler.jsonc#L83-L97" } ] },
    { "term": "migration", "tier": "general", "def": "A numbered SQL file that changes the schema, applied in order and never edited once it has run. The list of them is the schema's history.", "sources": [ { "kind": "official", "label": "Cloudflare - D1 migrations", "url": "https://developers.cloudflare.com/d1/reference/migrations/" } ] },
    { "term": "CHECK constraint", "tier": "general", "def": "A rule attached to a column that the database enforces on every write, refusing a row that breaks it. Here it is what keeps category and status to their known values.", "sources": [ { "kind": "project", "label": "worker/migrations/0001_initial_schema.sql L19-33", "url": "https://github.com/nczoning/nc-zoning-board/blob/20fc45673599d8b5fd7b786858bff37c3783af5f/worker/migrations/0001_initial_schema.sql#L19-L33" } ] },
    { "term": "index", "tier": "general", "def": "A lookup structure the database keeps so it can find matching rows without reading every one. Costs a little on write, saves a lot on a query that runs often.", "sources": [ { "kind": "project", "label": "worker/migrations/0001_initial_schema.sql L41-44", "url": "https://github.com/nczoning/nc-zoning-board/blob/20fc45673599d8b5fd7b786858bff37c3783af5f/worker/migrations/0001_initial_schema.sql#L41-L44" } ] },
    { "term": "dismissed candidate", "tier": "project", "def": "A Nexus mod someone looked at and decided not to put on the map. It is not a location and never was one; the row exists only to keep the mod off the candidates list.", "sources": [ { "kind": "project", "label": "worker/migrations/0001_initial_schema.sql L65-72", "url": "https://github.com/nczoning/nc-zoning-board/blob/20fc45673599d8b5fd7b786858bff37c3783af5f/worker/migrations/0001_initial_schema.sql#L65-L72" } ] },
    { "term": "audit log", "tier": "project", "def": "An append-only table recording who changed what and when. It is what replaces git log once records are edited through the API instead of through pull requests.", "sources": [ { "kind": "project", "label": "worker/src/audit.js L1-12", "url": "https://github.com/nczoning/nc-zoning-board/blob/20fc45673599d8b5fd7b786858bff37c3783af5f/worker/src/audit.js#L1-L12" } ] },
    { "term": "join table", "tier": "general", "def": "A table whose rows pair up two other tables, one row per link. location_tags holds one row per location-and-tag pair.", "sources": [ { "kind": "project", "label": "worker/migrations/0002_tags.sql L33-44", "url": "https://github.com/nczoning/nc-zoning-board/blob/20fc45673599d8b5fd7b786858bff37c3783af5f/worker/migrations/0002_tags.sql#L33-L44" } ] },
    { "term": "foreign key", "tier": "general", "def": "A column declared to point at another table's key, so the database can refuse a link to something that does not exist. It is how a typo'd tag becomes impossible rather than merely unlikely.", "sources": [ { "kind": "project", "label": "worker/migrations/0002_tags.sql L40-44", "url": "https://github.com/nczoning/nc-zoning-board/blob/20fc45673599d8b5fd7b786858bff37c3783af5f/worker/migrations/0002_tags.sql#L40-L44" } ] },
    { "term": "referential integrity", "tier": "general", "def": "The guarantee that every link points at something real. The database enforces it on write rather than a checker finding the break later.", "sources": [ { "kind": "project", "label": "worker/migrations/0002_tags.sql L33-39", "url": "https://github.com/nczoning/nc-zoning-board/blob/20fc45673599d8b5fd7b786858bff37c3783af5f/worker/migrations/0002_tags.sql#L33-L39" } ] },